AUTHOR,TITLE,PUBLISHEDat
BQ Prime,"Stock Market Today: Sensex, Nifty Post Biggest Single-Day Gain In Four Weeks; Adani, SBI Lead Rally - BQ Prime",2023-03-03T10:36:07Z
NDTV,"BJP Claims ""I Love Manish Sisodia"" Desks Soon At Delhi Government Schools, AAP Denies - NDTV",2023-03-03T10:14:40Z
Mint,Apple blocks email app update incorporating ChatGPT technology: Know here's why | Mint - Mint,2023-03-03T09:57:42Z
Koimoi,"Pathaan Box Office Day 37: Shah Rukh Khan, Deepika Padukone & John Abraham Starrer To Rewrite History Today, Set To Be The Biggest Hindi Film - Koimoi",2023-03-03T09:27:04Z
NDTV Movies,How Deepika Padukone's Biggest Cheerleader Ranveer Singh Reacted To Her Oscar Gig - NDTV Movies,2023-03-03T09:22:58Z
Indiatimes.com,India need to win 4th Test in Ahmedabad to qualify for WTC final - Indiatimes.com,2023-03-03T09:16:00Z
Hindustan Times,"Adani Group to hold fixed-income roadshows in London, US cities: Report - Hindustan Times",2023-03-03T08:57:56Z
The Hindu,Studies show how asteroid-bashing spacecraft was ‘phenomenally successful’ - The Hindu,2023-03-03T08:47:00Z
HT Tech,How the iPhone changed my biases after years of Android use - HT Tech,2023-03-03T08:46:09Z
ThePrint,"Had it not been for Debbarma’s TIPRA Motha, Congress-Left would have defeated BJP in Tripura - ThePrint",2023-03-03T08:29:19Z
NDTV Sports,"Ind vs Aus, 3rd Test: Australia Defeat India By 9 Wickets, Qualify For WTC Final - NDTV Sports",2023-03-03T08:28:00Z
ESPNcricinfo,"Stats: A rare home defeat for India, a forgettable Test for the umpires - ESPNcricinfo",2023-03-03T08:24:57Z
HT Tech,World Hearing Day: Noise App on Apple Watch can protect hearing health- Know how - HT Tech,2023-03-03T08:24:17Z
The Indian Express,"Russian foreign minister: Want India, China to be friends; Ukraine too should negotiate on war - The Indian Express",2023-03-03T08:10:38Z
India Today,"Sonia Gandhi admitted to Sir Ganga Ram hospital with fever, stable - India Today",2023-03-03T08:06:34Z
The Indian Express,Latest four-member SpaceX crew docks with International Space Station - The Indian Express,2023-03-03T07:50:14Z
NDTV,"Quad Is Like The Beatles, Says Japan's Foreign Minister In Delhi - NDTV",2023-03-03T07:22:00Z
Hindustan Times,"'BJP has given...': Meghalaya's Conrad Sangma meets Guv, stakes claim to govt - Hindustan Times",2023-03-03T07:14:48Z
The Indian Express,This NASA scientist from Uttar Pradesh village has created world’s fastest laser imaging tech to capture combustion - The Indian Express,2023-03-03T07:11:23Z
CNBC,India's Supreme Court sets up panel to investigate Adani allegations - CNBC,2023-03-03T06:56:37Z
